pair_id,members,shared_signature,activation_signature,tiebreaker_rule,tiebreaker_mapping,notes,refs
OS_vs_DDLPS,OS;SARC_DDLPS;SARC_WDLPS;SARC_LPS_UNSPEC,MDM2+CDK4+FRS2 amp (12q13-15),MDM2:100|CDK4:50,site_template,met_bone:OS|primary_bone:OS|met_soft_tissue:SARC_DDLPS|primary_retroperitoneum:SARC_DDLPS|primary_abdomen:SARC_DDLPS,"~10-15% of high-grade OS co-amplifies MDM2+CDK4 (12q); DDLPS carries the same amplicon. Site is the canonical tiebreaker — bone-site means OS not LPS. Pair only activates when MDM2>=100 or CDK4>=50 (amplified-signal present); low MDM2/CDK4 means no 12q-amp ambiguity to resolve.",PMID:29118094;PMID:20180028
EWS_vs_DSRCT_vs_ARMS,EWS;SARC_DSRCT;RMS_ARMS,CD99+ small-blue-round-cell,CD99:20,fusion_surrogate,FATE1:EWS|NR0B1:EWS|DAX1:EWS|WT1:SARC_DSRCT|MYOD1:RMS_ARMS|MYOG:RMS_ARMS,"EWS-FLI1 ectopically activates FATE1/NR0B1 via GGAA microsatellites (both near-silent in non-EWS tumors). DSRCT expresses WT1 C-terminal portion from EWSR1-WT1. ARMS requires myogenic MYOD1/MYOG from PAX3-FOXO1. Pair only activates when CD99 is elevated (>=20 TPM) — without the shared small-blue-round-cell signature there's no ambiguity.",PMID:17035403;PMID:24535093;PMID:26300585
PANNET_vs_MID_NET_vs_LUNG_NET,PANNET;MID_NET;LUNG_NET_LC;LUNG_NET_LCNEC,CHGA+SYP+ENO2,CHGA:20|SYP:20|ENO2:20,site_template,primary_pancreas:PANNET|met_pancreas:PANNET|primary_intestine:MID_NET|met_small_bowel:MID_NET|primary_lung:LUNG_NET_LC|met_lung:LUNG_NET_LCNEC,"NE markers CHGA/SYP/ENO2 shared across all well- and poorly-differentiated NETs; anatomic origin distinguishes pancreatic vs midgut vs lung carcinoid vs LCNEC. Pair only activates when at least one NE marker is meaningfully expressed; absent NE signal means the sample is not in the NET axis and no ambiguity applies.",PMID:32493693
LUSC_vs_HNSC_vs_CESC,LUSC;HNSC;CESC,squamous lineage (KRT5/KRT6A/TP63/SOX2),KRT5:20|KRT6A:20|TP63:10,site_template,primary_lung:LUSC|met_lung:LUSC|primary_head_neck:HNSC|primary_oral:HNSC|primary_oropharynx:HNSC|primary_cervix:CESC|primary_uterine_cervix:CESC,"All three carry KRT5/6 + TP63 + SOX2 squamous signature; site distinguishes tissue of origin. HPV-p16 status would further separate HNSC/CESC from LUSC but currently not in bulk-RNA pipeline. Pair only activates when the squamous marker panel is present.",PMID:22588877
CLL_vs_MCL_vs_FL,CLL;MCL;FL,B-cell markers (CD19/CD20/CD79A/MS4A1) + small-cell morphology,CD19:5|MS4A1:5|CD79A:5,marker_combo,CCND1:MCL|SOX11:MCL|BCL6:FL|LMO2:FL,"CCND1 translocation drives MCL and is almost pathognomonic at the expression level. BCL6/LMO2 signal germinal-center origin (FL). CLL lacks both but carries CD5+ mature-B signature. Pair only activates when the sample carries B-cell markers.",PMID:14983945;PMID:12438234
NUTM_vs_squamous,NUTM;LUSC;HNSC,NUTM1 mRNA + squamous lineage,NUTM1:1,fusion_surrogate,NUTM1:NUTM,"NUT carcinoma is genetically defined by NUTM1 rearrangement. NUTM1 mRNA is near-silent in normal tissues AND in non-NUT tumors (median <0.5 TPM across all TCGA cohorts including LUSC/HNSC/CESC); expression >=1 TPM in a squamous-ish sample is the ONLY reliable surrogate. PRAME and MAGE-A panels are NOT NUTM-specific — they are broadly expressed in LUSC (PRAME median 24.5 TPM, MAGEA3 median 42 TPM) and using them as disambiguators would systematically mis-call LUSC as NUT carcinoma. Pair only activates when NUTM1 is detectably expressed; otherwise the classifier's squamous pick stands without modification.",PMID:25486073;PMID:24491763
COAD_vs_READ,COAD;READ,colon vs rectum signature,,site_template,primary_colon:COAD|primary_rectum:READ|primary_rectosigmoid:READ,Classifier already uses provisional COAD/READ label when site is ambiguous. Listed here for completeness — the mechanism is the canonical example of site-driven subtype resolution. No activation signature because COAD/READ is always a valid pairing once cancer type is colorectal.,
